tieu_de,link
Nhân Viên Lập Trình Máy Phay (CNC) - 1 Năm Kinh Nghiệm - Làm Việc Tại Bình Dương,https://www.topcv.vn/viec-lam/nhan-vien-lap-trinh-may-phay-cnc-1-nam-kinh-nghiem-lam-viec-tai-binh-duong/2013330.html
Manual Software Tester (QA/QC From 3yrs Exp.),https://www.topcv.vn/viec-lam/manual-software-tester-qa-qc-from-3yrs-exp/2008447.html
"Tester Tiếng Nhật (N3/N2, Không Yêu Cầu Kinh Nghiệm)",https://www.topcv.vn/viec-lam/tester-tieng-nhat-n3-n2-khong-yeu-cau-kinh-nghiem/2002089.html
IT Fresher 2026 - Chương Trình Tuyển Dụng Và Phát Triển Nhân Tài Công Nghệ Trẻ (Hà Nội Và TP. Hồ Chí Minh),https://www.topcv.vn/viec-lam/it-fresher-2026-chuong-trinh-tuyen-dung-va-phat-trien-nhan-tai-cong-nghe-tre-ha-noi-va-tp-ho-chi-minh/2004227.html
NV Kiểm Thử Phần Mềm Tester -Có Thể Đi Làm Sau Tết,https://www.topcv.vn/viec-lam/nv-kiem-thu-phan-mem-tester-co-the-di-lam-sau-tet/1563425.html
Thực Tập Sinh Công Nghệ Thông Tin Có Lương,https://www.topcv.vn/viec-lam/thuc-tap-sinh-cong-nghe-thong-tin-co-luong/2005356.html
IT Helpdesk Engineer/ IT Support/ Công Nghệ Thông Tin CNTT Tại Hà Nội (Thu Nhập Hấp Dẫn),https://www.topcv.vn/viec-lam/it-helpdesk-engineer-it-support-cong-nghe-thong-tin-cntt-tai-ha-noi-thu-nhap-hap-dan/2002233.html
Thực Tập Sinh JavaScript - Playable Ads (Short Demo Game),https://www.topcv.vn/viec-lam/thuc-tap-sinh-javascript-playable-ads-short-demo-game/2005667.html
Data Analyst / Business Data Analyst,https://www.topcv.vn/viec-lam/data-analyst-business-data-analyst/2007309.html
Unity Developer,https://www.topcv.vn/viec-lam/unity-developer/2004834.html
Senior Software Engineer (NodeJS) - 5 Năm Kinh Nghiệm - Thu Nhập Từ 40 - 55 Triệu/Tháng,https://www.topcv.vn/viec-lam/senior-software-engineer-nodejs-5-nam-kinh-nghiem-thu-nhap-tu-40-55-trieu-thang/2000941.html
Chuyên Viên Phân Tích Nghiệp Vụ Cao Cấp (Senior Business Analyst),https://www.topcv.vn/viec-lam/chuyen-vien-phan-tich-nghiep-vu-cao-cap-senior-business-analyst/2002112.html
"Front-End Developer Shopify (Up To $2,500/Month)",https://www.topcv.vn/viec-lam/front-end-developer-shopify-up-to-2-500-month/1948477.html
Chuyên Viên BA EdTech Lương Thưởng Hấp Dẫn Đi Làm Sau Tết,https://www.topcv.vn/viec-lam/chuyen-vien-ba-edtech-luong-thuong-hap-dan-di-lam-sau-tet/2003287.html
Frontend / ReactJS / NextJS Developer - Từ 2 - 5 Năm Kinh Nghiệm - Thu Nhập 15 - 25 Triệu - Tại Hà Nội,https://www.topcv.vn/viec-lam/frontend-reactjs-nextjs-developer-tu-2-5-nam-kinh-nghiem-thu-nhap-15-25-trieu-tai-ha-noi/2009596.html
Thực Tập Sinh Công Nghệ Thông Tin (Có Lương + Mộc),https://www.topcv.vn/viec-lam/thuc-tap-sinh-cong-nghe-thong-tin-co-luong-moc/1977089.html
Digital Marketing - Có Ít Nhất Từ 1 Năm Kinh Nghiệm Chạy Ads,https://www.topcv.vn/viec-lam/digital-marketing-co-it-nhat-tu-1-nam-kinh-nghiem-chay-ads/1995259.html
Thực Tập Sinh Công Nghệ Thông Tin (Có Mộc+ Lương),https://www.topcv.vn/viec-lam/thuc-tap-sinh-cong-nghe-thong-tin-co-moc-luong/2005324.html
Manual Tester Domain Banking,https://www.topcv.vn/viec-lam/manual-tester-domain-banking/1973087.html
Chuyên Viên Phân Tích Nghiệp Vụ (BA),https://www.topcv.vn/viec-lam/chuyen-vien-phan-tich-nghiep-vu-ba/2012486.html
Android App Developer,https://www.topcv.vn/viec-lam/android-app-developer/2007294.html
Business Analyst,https://www.topcv.vn/viec-lam/business-analyst/1887317.html
Quality Control (Japanese N4) / Kiểm Thử Phần Mềm,https://www.topcv.vn/viec-lam/quality-control-japanese-n4-kiem-thu-phan-mem/2010192.html
Backend Developer (Golang),https://www.topcv.vn/viec-lam/backend-developer-golang/1664006.html
Customer Support (IT/ English Required) / Chuyên Viên Hỗ Trợ Khách Hàng Quốc Tế,https://www.topcv.vn/viec-lam/customer-support-it-english-required-chuyen-vien-ho-tro-khach-hang-quoc-te/2007184.html
"Senior JAVA Developer (5 Năm Kinh Nghiệm) Lương Từ 20 - 45 Triệu Tại Hà Nội, Đi Làm Ngay",https://www.topcv.vn/viec-lam/senior-java-developer-5-nam-kinh-nghiem-luong-tu-20-45-trieu-tai-ha-noi-di-lam-ngay/1823095.html
Business Analyst (Product Owner),https://www.topcv.vn/viec-lam/business-analyst-product-owner/2011370.html
Nhân Viên Kinh Doanh B2B - (3 - 5 Năm Kinh Nghiệm),https://www.topcv.vn/viec-lam/nhan-vien-kinh-doanh-b2b-3-5-nam-kinh-nghiem/1597848.html
Mobile Developer (Flutter/Android),https://www.topcv.vn/viec-lam/mobile-developer-flutter-android/2005217.html
Kiểm Thử Viên Chất Lượng (QA Tester) - Chuyên Về Mobile & Web,https://www.topcv.vn/viec-lam/kiem-thu-vien-chat-luong-qa-tester-chuyen-ve-mobile-web/2008396.html
Nhân Viên Phân Tích Nghiệp Vụ (Có Kinh Nghiệm),https://www.topcv.vn/viec-lam/nhan-vien-phan-tich-nghiep-vu-co-kinh-nghiem/2008836.html
Kỹ Sư Lập Trình Nhúng,https://www.topcv.vn/viec-lam/ky-su-lap-trinh-nhung/2009286.html
"Tester [Hà Nội] - Thu Nhập 9-20 Triệu, Nhiều Đãi Ngộ Hấp Dẫn Khác",https://www.topcv.vn/viec-lam/tester-ha-noi-thu-nhap-9-20-trieu-nhieu-dai-ngo-hap-dan-khac/2013194.html
"Team Lead / Technical Lead Java Full Stack (Spring Boot, Angular/ReactJS)",https://www.topcv.vn/viec-lam/team-lead-technical-lead-java-full-stack-spring-boot-angular-reactjs/2007653.html
Backend / ASP.NET C# Từ 2 - 5 Năm Kinh Nghiệm,https://www.topcv.vn/viec-lam/backend-asp-net-c-tu-2-5-nam-kinh-nghiem/2009627.html
"Fullstack Developer (.NET, React, SQL, C#) - Open Đi Làm Sau Tết Âm",https://www.topcv.vn/viec-lam/fullstack-developer-net-react-sql-c-open-di-lam-sau-tet-am/1835045.html
Chuyên Viên Phân Tích Nghiệp Vụ Tiếng Hàn,https://www.topcv.vn/viec-lam/chuyen-vien-phan-tich-nghiep-vu-tieng-han/1450382.html
Chuyên Viên Cao Cấp Nghiên Cứu Trải Nghiệm Người Dùng (UX Tester),https://www.topcv.vn/viec-lam/chuyen-vien-cao-cap-nghien-cuu-trai-nghiem-nguoi-dung-ux-tester/2009533.html
Middle Full-Stack Web Dev - Từ 3 Năm Kinh Nghiệm - Offer Upto 40M - Hà Nội,https://www.topcv.vn/viec-lam/middle-full-stack-web-dev-tu-3-nam-kinh-nghiem-offer-upto-40m-ha-noi/2009232.html
Lập Trình Viên Backend,https://www.topcv.vn/viec-lam/lap-trinh-vien-backend/2010302.html
Nhân Viên Tư Vấn Sale Online/ Chăm Sóc Khách Hàng (Game) - Thu Nhập Hấp Dẫn,https://www.topcv.vn/viec-lam/nhan-vien-tu-van-sale-online-cham-soc-khach-hang-game-thu-nhap-hap-dan/1966463.html
"Nhân Viên Kỹ Thuật [Hà Nội] - Thu Nhập Cạnh Tranh, Tối Thiểu 2 Năm Kinh Nghiệm",https://www.topcv.vn/viec-lam/nhan-vien-ky-thuat-ha-noi-thu-nhap-canh-tranh-toi-thieu-2-nam-kinh-nghiem/2006014.html
Trưởng Phòng Giải Pháp Công Nghệ Cao,https://www.topcv.vn/viec-lam/truong-phong-giai-phap-cong-nghe-cao/2011588.html
Nhân Viên Hỗ Trợ CNTT,https://www.topcv.vn/viec-lam/nhan-vien-ho-tro-cntt/2008780.html
AI | Machine Learning Developer,https://www.topcv.vn/viec-lam/ai-machine-learning-developer/2012694.html
Kỹ Sư Công Nghệ Thông Tin Tại Hà Nội/ Thu Nhập Upto 50M,https://www.topcv.vn/viec-lam/ky-su-cong-nghe-thong-tin-tai-ha-noi-thu-nhap-upto-50m/2011806.html
Software Quality Assurance (SQA) Engineer,https://www.topcv.vn/viec-lam/software-quality-assurance-sqa-engineer/1974982.html
Senior Business Analyst (Chuyển Đổi Số Khối CP),https://www.topcv.vn/viec-lam/senior-business-analyst-chuyen-doi-so-khoi-cp/1823145.html
Backend Python Developer For AI Agent Development Project,https://www.topcv.vn/viec-lam/backend-python-developer-for-ai-agent-development-project/1997032.html
Chuyên Viên Phân Tích Nghiệp Vụ Phần Mềm (Yêu Cầu Học Kế Toán/Kiểm Toán) - Phỏng Vấn Trước Tết - Onboard Sau Tết,https://www.topcv.vn/viec-lam/chuyen-vien-phan-tich-nghiep-vu-phan-mem-yeu-cau-hoc-ke-toan-kiem-toan-phong-van-truoc-tet-onboard-sau-tet/2005944.html
"IT Sales Executive (IT Outsourcing, B2B) - Upto 40M - Hà Nội",https://www.topcv.vn/viec-lam/it-sales-executive-it-outsourcing-b2b-upto-40m-ha-noi/2006775.html
Nhân Viên Triển Khai Giải Pháp ERP (Business Analyst - Vững Nghiệp Vụ Kế Toán),https://www.topcv.vn/viec-lam/nhan-vien-trien-khai-giai-phap-erp-business-analyst-vung-nghiep-vu-ke-toan/2013165.html
Unreal Engine Artist Tại Hồ Chí Minh (Lương 10tr - 30tr) CV Tiếng Anh Và Portfolio File Video,https://www.topcv.vn/viec-lam/unreal-engine-artist-tai-ho-chi-minh-luong-10tr-30tr-cv-tieng-anh-va-portfolio-file-video/1518603.html
NV Hỗ Trợ Khách Hàng Và Tư Vấn Triển Khai Phần Mềm,https://www.topcv.vn/viec-lam/nv-ho-tro-khach-hang-va-tu-van-trien-khai-phan-mem/2015075.html
Chuyên Viên Tư Vấn Giải Pháp (Presale),https://www.topcv.vn/viec-lam/chuyen-vien-tu-van-giai-phap-presale/1927330.html
UA Marketing (Android App) Tại Hà Nội (Lương Upto 20 Triệu + Thưởng),https://www.topcv.vn/viec-lam/ua-marketing-android-app-tai-ha-noi-luong-upto-20-trieu-thuong/2004008.html
Blockchain Backend Developer,https://www.topcv.vn/viec-lam/blockchain-backend-developer/1911430.html
Giảng Viên Khoa Công Nghệ Thông Tin Tại Hà Nội,https://www.topcv.vn/viec-lam/giang-vien-khoa-cong-nghe-thong-tin-tai-ha-noi/2000203.html
SAP Consultant (PP)| Lương Lên Đến $3000 (Hồ Chí Minh),https://www.topcv.vn/viec-lam/sap-consultant-pp-luong-len-den-3000-ho-chi-minh/1978930.html
"SAP Consultant (FICO) | Lương Lên Đến $3000 (Hồ Chí Minh, Hà Nội)",https://www.topcv.vn/viec-lam/sap-consultant-fico-luong-len-den-3000-ho-chi-minh-ha-noi/1725317.html
Senior VoIP Engineer Có Từ 3 Năm Kinh Nghiệm Thu Nhập Hấp Dẫn,https://www.topcv.vn/viec-lam/senior-voip-engineer-co-tu-3-nam-kinh-nghiem-thu-nhap-hap-dan/1995600.html
Korean Bridge Software Engineer - Kỹ Sư Cầu Nối Tiếng Hàn,https://www.topcv.vn/viec-lam/korean-bridge-software-engineer-ky-su-cau-noi-tieng-han/1696963.html
UA Lead For Mobile App (30-50M NET),https://www.topcv.vn/viec-lam/ua-lead-for-mobile-app-30-50m-net/1999222.html
IT Project Manager,https://www.topcv.vn/viec-lam/it-project-manager/1729935.html
Postsale Security Engineer - Upto 35M,https://www.topcv.vn/viec-lam/postsale-security-engineer-upto-35m/1994291.html
Kỹ Sư Sản Xuất (Thiết Lập Điều Kiện Máy Ép) - Lương Đến 30 Triệu - Có Thể Nhận Việc Sau Tết,https://www.topcv.vn/viec-lam/ky-su-san-xuat-thiet-lap-dieu-kien-may-ep-luong-den-30-trieu-co-the-nhan-viec-sau-tet/1972504.html
Trưởng Nhóm Học Thuật Về Lập Trình - Thủ Dầu Một (Bình Dương Cũ),https://www.topcv.vn/viec-lam/truong-nhom-hoc-thuat-ve-lap-trinh-thu-dau-mot-binh-duong-cu/1952097.html
Phân Tích Kinh Doanh (Business Analyst),https://www.topcv.vn/viec-lam/phan-tich-kinh-doanh-business-analyst/1985662.html
Tư Vấn Hạ Tầng CNTT,https://www.topcv.vn/viec-lam/tu-van-ha-tang-cntt/2003527.html
Bridge Software Engineer (Remote Tại Hà Nội),https://www.topcv.vn/viec-lam/bridge-software-engineer-remote-tai-ha-noi/2005046.html
Kỹ Sư Phần Mềm Robot/AMR (Software Engineer),https://www.topcv.vn/viec-lam/ky-su-phan-mem-robot-amr-software-engineer/2014123.html
Chuyên Viên Kế Toán Giá Thành Có Ít Nhất 2 Năm Kinh Nghiệm Tại Bắc Ninh (Thu Nhập 12-13 Triệu),https://www.topcv.vn/viec-lam/chuyen-vien-ke-toan-gia-thanh-co-it-nhat-2-nam-kinh-nghiem-tai-bac-ninh-thu-nhap-12-13-trieu/1977730.html
"Nhân Viên Kỹ Thuật IT, Điện Tử Viễn Thông - Kinh N",https://www.topcv.vn/viec-lam/nhan-vien-ky-thuat-it-dien-tu-vien-thong-kinh-n/1991773.html
Mentor Luyện Thi Chứng Chỉ AWS ISTQB,https://www.topcv.vn/viec-lam/mentor-luyen-thi-chung-chi-aws-istqb/2015310.html
Nhóm Trưởng Vận Hành Máy Phay CNC – Tiện CNC,https://www.topcv.vn/viec-lam/nhom-truong-van-hanh-may-phay-cnc-tien-cnc/2014991.html
Business Analyst (Domain ERP/CRM/HRM),https://www.topcv.vn/viec-lam/business-analyst-domain-erp-crm-hrm/2012797.html
Senior Project Manager,https://www.topcv.vn/viec-lam/senior-project-manager/2013652.html
Middle SAP MM/SD Consultant,https://www.topcv.vn/viec-lam/middle-sap-mm-sd-consultant/1962743.html
Nhân Viên Kinh Doanh Hỗ Trợ Dự Án IT & CCTV - Thu Nhập Từ 25 Triệu - Kinh Nghiệm Từ 2 Năm - Hồ Chí Minh,https://www.topcv.vn/viec-lam/nhan-vien-kinh-doanh-ho-tro-du-an-it-cctv-thu-nhap-tu-25-trieu-kinh-nghiem-tu-2-nam-ho-chi-minh/1533657.html
Nhân Viên Tư Vấn Dịch Vụ Website - Lương Thưởng Hấp Dẫn,https://www.topcv.vn/viec-lam/nhan-vien-tu-van-dich-vu-website-luong-thuong-hap-dan/2007553.html
Quản Lý Ca Trực Nhà Hàng - Kinh Nghiệm Ít Nhất 6 Tháng Trong F&B - McDonald'S Khu Vực Phú Quốc ( Thu Nhập Lên Đến 15 Triệu),https://www.topcv.vn/viec-lam/quan-ly-ca-truc-nha-hang-kinh-nghiem-it-nhat-6-thang-trong-fb-mcdonalds-khu-vuc-phu-quoc-thu-nhap-len-den-15-trieu/1964340.html
CVCC/CG Quản Trị Rủi Ro Công Nghệ Thông Tin (Digital Channel Risk Management Specialist),https://www.topcv.vn/viec-lam/cvcc-cg-quan-tri-rui-ro-cong-nghe-thong-tin-digital-channel-risk-management-specialist/1971205.html
Fullstack AI Intern,https://www.topcv.vn/viec-lam/fullstack-ai-intern/2007044.html
Java Spring Boot,https://www.topcv.vn/viec-lam/java-spring-boot/2002424.html
Fresher Business Analyst (Dịch Vụ Chuyển Đổi Số),https://www.topcv.vn/viec-lam/fresher-business-analyst-dich-vu-chuyen-doi-so/1537223.html
Lập Trình Viên Web Front-End (ReactJS/NextJS),https://www.topcv.vn/viec-lam/lap-trinh-vien-web-front-end-reactjs-nextjs/2002116.html
Chuyên Viên/ Nhân Viên ERP,https://www.topcv.vn/viec-lam/chuyen-vien-nhan-vien-erp/2006136.html
"Thực Tập Sinh PHP (Sinh Viên Năm Cuối, Backend)",https://www.topcv.vn/viec-lam/thuc-tap-sinh-php-sinh-vien-nam-cuoi-backend/2003145.html
Business Analyst & Technology Support,https://www.topcv.vn/viec-lam/business-analyst-technology-support/2003620.html
IT Helpdesk,https://www.topcv.vn/viec-lam/it-helpdesk/1913864.html
Internship Back-End Developer (NODE.JS/PYTHON) Thu Nhập Upto 9 Triệu,https://www.topcv.vn/viec-lam/internship-back-end-developer-node-js-python-thu-nhap-upto-9-trieu/2006055.html
Software Tester (Manual & Automation),https://www.topcv.vn/viec-lam/software-tester-manual-automation/2004876.html
Frontend Developer,https://www.topcv.vn/viec-lam/frontend-developer/1886042.html
Nhân Viên Business Analyst,https://www.topcv.vn/viec-lam/nhan-vien-business-analyst/2002963.html
Lập Trình Viên Frontend,https://www.topcv.vn/viec-lam/lap-trinh-vien-frontend/1949892.html
Internship/Fresher UA Marketing Mobile App,https://www.topcv.vn/viec-lam/internship-fresher-ua-marketing-mobile-app/2003728.html
Thực Tập Sinh Vận Hành Hệ Thống,https://www.topcv.vn/viec-lam/thuc-tap-sinh-van-hanh-he-thong/1124480.html
Chuyên Viên Cao Cấp Phân Tích Nghiệp Vụ (Kênh Ngân Hàng Số),https://www.topcv.vn/viec-lam/chuyen-vien-cao-cap-phan-tich-nghiep-vu-kenh-ngan-hang-so/1647922.html
Web Developer,https://www.topcv.vn/viec-lam/web-developer/2006508.html
Java Developer,https://www.topcv.vn/viec-lam/java-developer/2004895.html
Business Analyst,https://www.topcv.vn/viec-lam/business-analyst/1320794.html
Thực Tập Mobile App Developer,https://www.topcv.vn/viec-lam/thuc-tap-mobile-app-developer/2002353.html
Senior Tester,https://www.topcv.vn/viec-lam/senior-tester/1886068.html
Thực Tập Sinh .Net (Technical Support),https://www.topcv.vn/viec-lam/thuc-tap-sinh-net-technical-support/1711560.html
PHP Developer (Magento),https://www.topcv.vn/viec-lam/php-developer-magento/2003642.html
Senior Mobile Developer (Flutter/IOS/Android/Dart),https://www.topcv.vn/viec-lam/senior-mobile-developer-flutter-ios-android-dart/2002289.html
Nhân Viên Bảo Trì Website Alibaba,https://www.topcv.vn/viec-lam/nhan-vien-bao-tri-website-alibaba/2006564.html
AI Team Lead (Researcher + Developer),https://www.topcv.vn/viec-lam/ai-team-lead-researcher-developer/2008229.html
Senior .NET (Định Hướng Techlead),https://www.topcv.vn/viec-lam/senior-net-dinh-huong-techlead/2004395.html
Business Analyst (Domain Fintech),https://www.topcv.vn/viec-lam/business-analyst-domain-fintech/2003071.html
Full Stack Developer Intern (Nodejs & Reactjs),https://www.topcv.vn/viec-lam/full-stack-developer-intern-nodejs-reactjs/2008356.html
Backend Developer/ Kỹ Sư Golang - Thu Nhập Không Giới Hạn (Nhận Việc Ngay),https://www.topcv.vn/viec-lam/backend-developer-ky-su-golang-thu-nhap-khong-gioi-han-nhan-viec-ngay/1931370.html
"Kỹ Sư Đảm Bảo Chất Lượng/ Fresher - Middle QA/ Tester - Tiếng Anh Tốt - Làm Việc Tại Hà Nội, Đà Nẵng - Thu Nhập Cao",https://www.topcv.vn/viec-lam/ky-su-dam-bao-chat-luong-fresher-middle-qa-tester-tieng-anh-tot-lam-viec-tai-ha-noi-da-nang-thu-nhap-cao/1445229.html
Quality Assurance (QA),https://www.topcv.vn/viec-lam/quality-assurance-qa/1938195.html
Lập Trình Viên Back-End (Java),https://www.topcv.vn/viec-lam/lap-trinh-vien-back-end-java/2008766.html
Unity WebGL And HTML5 Game Developer,https://www.topcv.vn/viec-lam/unity-webgl-and-html5-game-developer/2002429.html
Lập Trình Viên AI,https://www.topcv.vn/viec-lam/lap-trinh-vien-ai/1975838.html
Web Developer (Remote Tại Hà Nội Hoặc Đà Nẵng),https://www.topcv.vn/viec-lam/web-developer-remote-tai-ha-noi-hoac-da-nang/2005028.html
Chuyên Viên IT Support,https://www.topcv.vn/viec-lam/chuyen-vien-it-support/2006663.html
Nhân Viên Tester/QC,https://www.topcv.vn/viec-lam/nhan-vien-tester-qc/2007196.html
IT Comtor (Tiếng Nhật),https://www.topcv.vn/viec-lam/it-comtor-tieng-nhat/1678280.html
Java Software Engineer,https://www.topcv.vn/viec-lam/java-software-engineer/2008016.html
Backend Engineer,https://www.topcv.vn/viec-lam/backend-engineer/1833827.html
Nhân Viên Kế Toán Học Việc - Ít Kinh Nghiệm,https://www.topcv.vn/viec-lam/nhan-vien-ke-toan-hoc-viec-it-kinh-nghiem/2001403.html
Fullstack Developer - YC 5 Năm Kinh Nghiệm,https://www.topcv.vn/viec-lam/fullstack-developer-yc-5-nam-kinh-nghiem/2005603.html
Lập Trình Viên Backend (Python),https://www.topcv.vn/viec-lam/lap-trinh-vien-backend-python/2002623.html
Senior Back-End Developer (.Net/Golang),https://www.topcv.vn/viec-lam/senior-back-end-developer-net-golang/2005282.html
Fresher Mobile Developer,https://www.topcv.vn/viec-lam/fresher-mobile-developer/2006976.html
Nhân Viên Kiểm Soát Chất Lượng QC/ Software Tester Đi Làm Ngay Hoặc Ra Tết Đi Làm,https://www.topcv.vn/viec-lam/nhan-vien-kiem-soat-chat-luong-qc-software-tester-di-lam-ngay-hoac-ra-tet-di-lam/1980240.html
Backend Engineer (Go / Distributed Systems),https://www.topcv.vn/viec-lam/backend-engineer-go-distributed-systems/2004683.html
PHP Developer ERP Cross-Border – YII – Tiếng Trung,https://www.topcv.vn/viec-lam/php-developer-erp-cross-border-yii-tieng-trung/2007243.html
Java Developer - Đi Làm Ngay Hoặc Ra Tết Đi Làm,https://www.topcv.vn/viec-lam/java-developer-di-lam-ngay-hoac-ra-tet-di-lam/1761414.html
Backend Java Developer (Từ 2 Năm Kinh Nghiệm),https://www.topcv.vn/viec-lam/backend-java-developer-tu-2-nam-kinh-nghiem/1954840.html
Nhân Viên Kinh Doanh Dự Án IT,https://www.topcv.vn/viec-lam/nhan-vien-kinh-doanh-du-an-it/1670505.html
Nhân Viên Kỹ Thuật (IT Helpdesk),https://www.topcv.vn/viec-lam/nhan-vien-ky-thuat-it-helpdesk/2007033.html
Frontend Developer - Đi Làm Ngay Hoặc Ra Tết Đi Làm,https://www.topcv.vn/viec-lam/frontend-developer-di-lam-ngay-hoac-ra-tet-di-lam/1651361.html
Senior Frontend Developer (React.Js/Next.Js) - Mức Lương Upto 30M,https://www.topcv.vn/viec-lam/senior-frontend-developer-react-js-next-js-muc-luong-upto-30m/1967715.html
"Manual Tester (App, Web, API, SQL)",https://www.topcv.vn/viec-lam/manual-tester-app-web-api-sql/1953087.html
Senior System Engineer (Linux),https://www.topcv.vn/viec-lam/senior-system-engineer-linux/1963656.html
Intern Backend Dev (PHP Or Python),https://www.topcv.vn/viec-lam/intern-backend-dev-php-or-python/2012517.html
Nhân Viên Kỹ Thuật,https://www.topcv.vn/viec-lam/nhan-vien-ky-thuat/2007387.html
Product Manager,https://www.topcv.vn/viec-lam/product-manager/1886198.html
Software Developer (C++/Golang),https://www.topcv.vn/viec-lam/software-developer-c-golang/1637012.html
IT Helpdesk Intern,https://www.topcv.vn/viec-lam/it-helpdesk-intern/2005494.html
Web Development Engineer (Remote),https://www.topcv.vn/viec-lam/web-development-engineer-remote/2012833.html
Business Analyst - Đi Làm Ngay Hoặc Ra Tết Đi Làm,https://www.topcv.vn/viec-lam/business-analyst-di-lam-ngay-hoac-ra-tet-di-lam/1962034.html
Game Tester (Junior),https://www.topcv.vn/viec-lam/game-tester-junior/2004907.html
Business Analyst (IT/Gaming Industry) - Fresher Up,https://www.topcv.vn/viec-lam/business-analyst-it-gaming-industry-fresher-up/1453909.html
Angular Developer,https://www.topcv.vn/viec-lam/angular-developer/2002807.html
Project Manager - Phát Triển Phần Mềm,https://www.topcv.vn/viec-lam/project-manager-phat-trien-phan-mem/1844457.html
"IT Customer Support (Open For Fresher, English Fluency, Up To 24mil Gross)",https://www.topcv.vn/viec-lam/it-customer-support-open-for-fresher-english-fluency-up-to-24mil-gross/2009953.html
Business Analyst (Có Kinh Nghiệm Với SAP/ Oracle/ MES),https://www.topcv.vn/viec-lam/business-analyst-co-kinh-nghiem-voi-sap-oracle-mes/2003558.html
IoT Developer (Chuyên Về UAV),https://www.topcv.vn/viec-lam/iot-developer-chuyen-ve-uav/1634266.html
Senior Java Developer,https://www.topcv.vn/viec-lam/senior-java-developer/1946319.html
Business Analyst,https://www.topcv.vn/viec-lam/business-analyst/1973660.html
Thực Tập Sinh Game Tester (QA),https://www.topcv.vn/viec-lam/thuc-tap-sinh-game-tester-qa/1671850.html
Embedded System Tester,https://www.topcv.vn/viec-lam/embedded-system-tester/2009901.html
Frontend Developer (ReactJS),https://www.topcv.vn/viec-lam/frontend-developer-reactjs/2013316.html
Sale IT Từ 6 Tháng Kinh Nghiệm - Hoa Hồng Upto 20% - Có Thể Đi Làm Sau Tết,https://www.topcv.vn/viec-lam/sale-it-tu-6-thang-kinh-nghiem-hoa-hong-upto-20-co-the-di-lam-sau-tet/1980451.html
Business Analyst (Shopify B2B),https://www.topcv.vn/viec-lam/business-analyst-shopify-b2b/2007908.html
Fullstack .Net Technical Support,https://www.topcv.vn/viec-lam/fullstack-net-technical-support/2009418.html
Java Developer (Middle/Senior),https://www.topcv.vn/viec-lam/java-developer-middle-senior/2004386.html
Fullstack Developer - Từ 2 Năm Kinh Nghiệm Trở Lên - Gò Vấp,https://www.topcv.vn/viec-lam/fullstack-developer-tu-2-nam-kinh-nghiem-tro-len-go-vap/1637037.html
Chuyên Viên Hỗ Trợ Vận Hành Hệ Thống Oracle EBS,https://www.topcv.vn/viec-lam/chuyen-vien-ho-tro-van-hanh-he-thong-oracle-ebs/1949808.html
Junior Manual Tester Onsite Bank,https://www.topcv.vn/viec-lam/junior-manual-tester-onsite-bank/1978147.html
Tester / QA (Full-Time),https://www.topcv.vn/viec-lam/tester-qa-full-time/2007544.html
DotNET Developer,https://www.topcv.vn/viec-lam/dotnet-developer/1191637.html
Nhân Viên IT Xử Lý Phần Mềm,https://www.topcv.vn/viec-lam/nhan-vien-it-xu-ly-phan-mem/2012387.html
Technical Leader (PHP/Laravel),https://www.topcv.vn/viec-lam/technical-leader-php-laravel/1994250.html
Business Analyst (Domain Bank/Fintech),https://www.topcv.vn/viec-lam/business-analyst-domain-bank-fintech/2008069.html
IT Helpdesk,https://www.topcv.vn/viec-lam/it-helpdesk/1812402.html
Senior Sales B2B- HCM,https://www.topcv.vn/viec-lam/senior-sales-b2b-hcm/2004634.html
Quality Assurance (Cum Business Analyst),https://www.topcv.vn/viec-lam/quality-assurance-cum-business-analyst/1835499.html
Intern AI - ERP - Software Developer,https://www.topcv.vn/viec-lam/intern-ai-erp-software-developer/1987778.html
Dev (Java Backend) - Từ 2 Năm KN - Dự Án Bank/Finance - UPTO 25M,https://www.topcv.vn/viec-lam/dev-java-backend-tu-2-nam-kn-du-an-bank-finance-upto-25m/2010710.html
TECH LEAD / CO-OWNER (MMO Application & Software As A Service),https://www.topcv.vn/viec-lam/tech-lead-co-owner-mmo-application-software-as-a-service/2002006.html
Business Analyst (Japanese Speaking),https://www.topcv.vn/viec-lam/business-analyst-japanese-speaking/1820395.html
Unity Developer,https://www.topcv.vn/viec-lam/unity-developer/2009264.html
System Admin,https://www.topcv.vn/viec-lam/system-admin/2008028.html
Business Solution Consultant (Presales & Tư Vấn Giải Pháp) - Thu Nhập Hấp Dẫn - Làm Việc Tại Hồ Chí Minh,https://www.topcv.vn/viec-lam/business-solution-consultant-presales-tu-van-giai-phap-thu-nhap-hap-dan-lam-viec-tai-ho-chi-minh/2003056.html
DevOps Engineer (Junior/Middle/Senior),https://www.topcv.vn/viec-lam/devops-engineer-junior-middle-senior/2004379.html
Senior 5+Yoe PHP/ Laravel Developer,https://www.topcv.vn/viec-lam/senior-5-yoe-php-laravel-developer/2009469.html
Lập Trình Viên - Backend Developer,https://www.topcv.vn/viec-lam/lap-trinh-vien-backend-developer/2011981.html
Unity Developer (Casual/Puzzle) - Junior/Middle,https://www.topcv.vn/viec-lam/unity-developer-casual-puzzle-junior-middle/942549.html
Game Tester,https://www.topcv.vn/viec-lam/game-tester/2007445.html
Nhân Viên React Native Mobile,https://www.topcv.vn/viec-lam/nhan-vien-react-native-mobile/1086109.html
"Lập Trình Viên Java (Product Domain Bank, Fintech)",https://www.topcv.vn/viec-lam/lap-trinh-vien-java-product-domain-bank-fintech/1976246.html
"IT Phần Cứng Laptop, PC (Thinkpad, Legion..) Nghỉ T7,CN Tại Hà Nội",https://www.topcv.vn/viec-lam/it-phan-cung-laptop-pc-thinkpad-legion-nghi-t7-cn-tai-ha-noi/1598493.html
Quality Engineer ( Automation & Manual Test- Upto 25M Net),https://www.topcv.vn/viec-lam/quality-engineer-automation-manual-test-upto-25m-net/2010834.html
Android Developer,https://www.topcv.vn/viec-lam/android-developer/1926713.html
