tieu_de,tieu_de_clean
Digital Marketing - Có Ít Nhất Từ 1 Năm Kinh Nghiệm Chạy Ads,digital marketing - có ít nhất từ 1 năm kinh nghiệm chạy ads
Nhân Viên Kinh Doanh B2B - (3 - 5 Năm Kinh Nghiệm),nhân viên kinh doanh b2b - 3 - 5 năm kinh nghiệm
"Nhân Viên Kỹ Thuật [Hà Nội] - Thu Nhập Cạnh Tranh, Tối Thiểu 2 Năm Kinh Nghiệm",nhân viên kỹ thuật hà nội - thu nhập cạnh tranh tối thiểu 2 năm kinh nghiệm
Trưởng Phòng Giải Pháp Công Nghệ Cao,trưởng phòng giải pháp công nghệ cao
"IT Sales Executive (IT Outsourcing, B2B) - Upto 40M - Hà Nội",it sales executive it outsourcing b2b - upto 40m - hà nội
Chuyên Viên Tư Vấn Giải Pháp (Presale),chuyên viên tư vấn giải pháp presale
Giảng Viên Khoa Công Nghệ Thông Tin Tại Hà Nội,giảng viên khoa công nghệ thông tin tại hà nội
"SAP Consultant (FICO) | Lương Lên Đến $3000 (Hồ Chí Minh, Hà Nội)",sap consultant fico lương lên đến 3000 hồ chí minh hà nội
SAP Consultant (PP)| Lương Lên Đến $3000 (Hồ Chí Minh),sap consultant pp lương lên đến 3000 hồ chí minh
Chuyên Viên Kế Toán Giá Thành Có Ít Nhất 2 Năm Kinh Nghiệm Tại Bắc Ninh (Thu Nhập 12-13 Triệu),chuyên viên kế toán giá thành có ít nhất 2 năm kinh nghiệm tại bắc ninh thu nhập 12-13 triệu
"Nhân Viên Kỹ Thuật IT, Điện Tử Viễn Thông - Kinh N",nhân viên kỹ thuật it điện tử viễn thông - kinh n
Middle SAP MM/SD Consultant,middle sap mm sd consultant
Nhân Viên Tư Vấn Dịch Vụ Website - Lương Thưởng Hấp Dẫn,nhân viên tư vấn dịch vụ website - lương thưởng hấp dẫn
Tư Vấn Hạ Tầng CNTT,tư vấn hạ tầng cntt
Quản Lý Ca Trực Nhà Hàng - Kinh Nghiệm Ít Nhất 6 Tháng Trong F&B - McDonald'S Khu Vực Phú Quốc ( Thu Nhập Lên Đến 15 Triệu),quản lý ca trực nhà hàng - kinh nghiệm ít nhất 6 tháng trong f b - mcdonald s khu vực phú quốc thu nhập lên đến 15 triệu
IT Helpdesk (Có Phụ Cấp Đi Lại & Nhà Ở),it helpdesk có phụ cấp đi lại nhà ở
Chuyên Viên/ Nhân Viên ERP,chuyên viên nhân viên erp
IT Helpdesk,it helpdesk
IT Comtor (Tiếng Nhật),it comtor tiếng nhật
Nhân Viên Bảo Trì Website Alibaba,nhân viên bảo trì website alibaba
Senior .NET (Định Hướng Techlead),senior __DOTNET__ định hướng techlead
Nhân Viên Kỹ Thuật,nhân viên kỹ thuật
Nhân Viên Kế Toán Học Việc - Ít Kinh Nghiệm,nhân viên kế toán học việc - ít kinh nghiệm
Nhân Viên Kỹ Thuật (IT Helpdesk),nhân viên kỹ thuật it helpdesk
Nhân Viên Kinh Doanh Dự Án IT,nhân viên kinh doanh dự án it
Sale IT Từ 6 Tháng Kinh Nghiệm - Hoa Hồng Upto 20% - Có Thể Đi Làm Sau Tết,sale it từ 6 tháng kinh nghiệm - hoa hồng upto 20 - có thể đi làm sau tết
"IT Phần Cứng Laptop, PC (Thinkpad, Legion..) Nghỉ T7,CN Tại Hà Nội",it phần cứng laptop pc thinkpad legion nghỉ t7 cn tại hà nội
Business Solution Consultant (Presales & Tư Vấn Giải Pháp) - Thu Nhập Hấp Dẫn - Làm Việc Tại Hồ Chí Minh,business solution consultant presales tư vấn giải pháp - thu nhập hấp dẫn - làm việc tại hồ chí minh
Senior Sales B2B- HCM,senior sales b2b- hcm
IT Helpdesk,it helpdesk
IT Helpdesk,it helpdesk
IT Manager (Fluent In English),it manager fluent in english
Sales Executive - Thu Nhập Hấp Dẫn - Làm Việc Tại Hồ Chí Minh,sales executive - thu nhập hấp dẫn - làm việc tại hồ chí minh
Nhân Viên Kinh Doanh B2B – IT / Laptop (HCM & HN),nhân viên kinh doanh b2b it laptop hcm hn
Microsoft 365 Solutions Specialist - Salary Up 40M - 60M,microsoft 365 solutions specialist - salary up 40m - 60m
Nhân Viên IT,nhân viên it
Nhân Viên Vận Hành Hệ Thống CRM (Tiếng Nhật N2),nhân viên vận hành hệ thống crm tiếng nhật n2
Trợ Lý Dự Án IT,trợ lý dự án it
Nhân Viên Kỹ Thuật Viễn Thông,nhân viên kỹ thuật viễn thông
Nhân Viên Kinh Doanh Viễn Thông,nhân viên kinh doanh viễn thông
Kỹ Thuật Hệ Thống Mạng Và Thiết Bị,kỹ thuật hệ thống mạng và thiết bị
Kỹ Thuật Viên Âm Thanh,kỹ thuật viên âm thanh
Sales IT Manager Thị Trường Nhật,sales it manager thị trường nhật
ERP Consultant,erp consultant
Nhân Viên Kinh Doanh Dự Án B2B (IT/Telecom),nhân viên kinh doanh dự án b2b it telecom
IT Development Manager,it development manager
Senior IT Sales Representative,senior it sales representative
"Nhân Viên Kỹ Thuật Lắp Đặt, Bảo Dưỡng Mạng, Camera",nhân viên kỹ thuật lắp đặt bảo dưỡng mạng camera
Senior .Net,senior __DOTNET__
Senior NestJS,senior nestjs
IT Comtor - Tiếng Hàn,it comtor - tiếng hàn
Sales IT - Business Development (Topik 5/6),sales it - business development topik 5 6
Senior NestJS,senior nestjs
Giáo Viên Môn Công Nghệ Thông Tin (ICT/IT),giáo viên môn công nghệ thông tin ict it
Nhân Viên IT,nhân viên it
Giảng Viên Khoa Công Nghệ Thông Tin,giảng viên khoa công nghệ thông tin
Nhân Viên Dự Án Công Nghệ Thông Tin,nhân viên dự án công nghệ thông tin
IT Account Manager/Sales B2B (Banking Project),it account manager sales b2b banking project
Korean IT Comtor,korean it comtor
Chuyên Viên Tuyển Dụng - IT,chuyên viên tuyển dụng - it
Leader Java,leader java
Trợ Lý Kỹ Thuật Vận Hành Máy Bay Nông Nghiệp,trợ lý kỹ thuật vận hành máy bay nông nghiệp
Chuyên Viên Kinh Doanh Dự Án B2B Lĩnh Vực CNTT,chuyên viên kinh doanh dự án b2b lĩnh vực cntt
Leader Nodejs - Đi Làm Ngay,leader nodejs - đi làm ngay
Sales Leader (IT Solution),sales leader it solution
Chuyên Viên Chuyển Đổi Số,chuyên viên chuyển đổi số
Senior Java,senior java
Nhân Viên Kinh Doanh - Ngành Công Nghệ Thông Tin,nhân viên kinh doanh - ngành công nghệ thông tin
Java Team Leader - Viettel Digital,java team leader - viettel digital
IT Application Leader,it application leader
Tư Vấn Khách Hàng Dịch Vụ IT,tư vấn khách hàng dịch vụ it
NV Kinh Doanh-Thiết Bị & Giải Pháp Nghe Nhìn AV/IT,nv kinh doanh-thiết bị giải pháp nghe nhìn av it
Chuyên Viên Tuyển Dụng,chuyên viên tuyển dụng
Sales Executive (IT)_Thị Trường Tiếng Anh,sales executive it _thị trường tiếng anh
Presales Consultant,presales consultant
Nhân Viên Kỹ Thuật CNC,nhân viên kỹ thuật cnc
Chuyên Viên Tư Vấn Giải Pháp CNTT(Presales),chuyên viên tư vấn giải pháp cntt presales
Phiên Dịch Tiếng Nhật (IT Comtor),phiên dịch tiếng nhật it comtor
IT Business Development,it business development
"Chuyên Viên Kinh Doanh/ Sales Ngành Camera, CNTT",chuyên viên kinh doanh sales ngành camera cntt
Chuyên Viên Tuyển Dụng IT_Tiếng Nhật,chuyên viên tuyển dụng it_tiếng nhật
IT Comtor (N2),it comtor n2
Nhân Viên Kinh Doanh,nhân viên kinh doanh
[Hanoi] Pre-Sales,hanoi pre-sales
Software Delivery Manager,software delivery manager
Phó Phòng Kỹ Thuật,phó phòng kỹ thuật
Giảng Viên Cơ Hữu Ngành Công Nghệ Thông Tin,giảng viên cơ hữu ngành công nghệ thông tin
Chuyên Viên Mua Hàng (IT Purchasing),chuyên viên mua hàng it purchasing
Projects Manager – Workflow & Automation,projects manager workflow automation
Chuyên Viên Tư Vấn,chuyên viên tư vấn
Cộng Tác Viên Wordpress (Có Tiếng Anh Giao Tiếp),cộng tác viên wordpress có tiếng anh giao tiếp
Nhân Viên Kinh Doanh IT Phần Cứng,nhân viên kinh doanh it phần cứng
Solutions Architect,solutions architect
Business Development Software,business development software
Business Development Executive,business development executive
Nhân Viên Sales IT,nhân viên sales it
Business Development Manager (IT/Software),business development manager it software
Nhân Viên Linh Kiện IT (6-Month Contract),nhân viên linh kiện it 6-month contract
Giám Đốc Công Nghệ (CTO),giám đốc công nghệ cto
Nhân Viên Kinh Doanh Công Nghệ Thông Tin MobiFone,nhân viên kinh doanh công nghệ thông tin mobifone
Trưởng Nhóm Số Hóa Tài Liệu,trưởng nhóm số hóa tài liệu
Nhóm Trưởng Vận Hành Máy Phay CNC – Tiện CNC,nhóm trưởng vận hành máy phay cnc tiện cnc
Nhân Viên PC Control,nhân viên pc control
Trợ Lý Giám Đốc - Bộ Phận Máy,trợ lý giám đốc - bộ phận máy
Nhân Viên Kỹ Thuật Máy Tính Biết Tiếng Trung,nhân viên kỹ thuật máy tính biết tiếng trung
Nhân Viên Vận Hành CMM,nhân viên vận hành cmm
Sales Executive (Edtech/Sofware/IT Solutions/SaaS),sales executive edtech sofware it solutions saas
Sales Dự Án CNTT/ĐTVT,sales dự án cntt đtvt
Nhân Viên Kỹ Thuật IT,nhân viên kỹ thuật it
IT Comtor,it comtor
IT Comtor,it comtor
Sales IT,sales it
"Tư Vấn Giải Pháp Kỹ Thuật (ELV, ME)",tư vấn giải pháp kỹ thuật elv me
IT Helpdesk,it helpdesk
Nhân Viên Kinh Doanh Công Nghệ Thông Tin,nhân viên kinh doanh công nghệ thông tin
